<?xml version="1.0" encoding="utf-8"?>
<logs xmlns="log" xmlns:xsi="http://www.w3.org/2001/XMLSchema-instance"
	xsi:schemaLocation="log log.xsd">

  <change who="polx" date="2006-07-26">
	  <files>
			<file>sts/integer1.sts</file>
	  	<file>sts/linalg2.sts</file>
		</files>
		<toldat>xx-mail-list-urls</toldat>
		<thanksto>Gl√≥ria Casanellas</thanksto>
		<log>Two little sts errors corrected.</log>
	</change>


  <change who="polx" date="2006-08-11">
	  <file>cd/units_ops1.ocd</file>
		<toldat>http://jira.activemath.org/browse/OM-1</toldat>
		<thanksto>William Naylor</thanksto>
		<log> Made the content of this CD sensible... 
		  missing the presentation of formula, just put as prefix for now. </log>
  </change>
  
	
	
	<persons>
		<person id="polx" name="Paul Libbrecht" email="paul@activemath.org"/>
		<person id="bill" name="William Naylor" email="wn@cs.bath.ac.uk"/>
	</persons>
</logs>


<!-- is this format ok with you ?
  are you a person that validates permanently ? -->
